Ttxil-k, awey-d tasarut tameɣradant.
Ttxil-k, bder-d yal amaslaḍ s yisem.
Ttxil-k, cfu ɣef wayen ay ak-d-nniɣ.
Ttxil-k, ddem-d imru-nni seg tegnit.
Ttxil-k, ɛawed ɣer-it tikkelt niḍen.
Ttxil-k, efk-as akk ilellac-a i Tom.
Ttxil-k, ɣer-d i wid ara aɣ-iɛawnen.
Ttxil-k, ɣer-iyi-d ma iwet-d wenẓar.
Ttxil-k, ɣer-iyi-d uqbel ma tusid-d.
Ttxil-k, ɣleq tawwurt mi ara tedduḍ.
Ttxil-k, qqen-iyi ɣer Uduktur White.
Ttxil-k, sɛeddi tanqiḍt-nni i wiyaḍ.
Ttxil-k, sɛeddi-iyi-d Tamsiwt Brown.
Ttxil-k, ur reẓẓem ara tazewwut-nni.
Ttxil-k, ur zerreb ara deg tmeslayt.
Ttxil-kent ɛiwnemt-iyi deg ccɣel-iw.
Ttxil-kent siwlemt-iyi-d deg iḍ-agi.
Ttxil-m ur tettu ara ayen i d-nenna.
Ttxil-m ur ttnal ara tijeǧǧigin-nni.
Ttxil-m, aru isem-nnem deg wedlis-a.
Ttxil-m, awey-d tasarut tameɣradant.
Ttxil-m, bder-d yal amaslaḍ s yisem.
Ttxil-m, ɣer-d i wid ara aɣ-iɛawnen.
Ttxil-m, ɣer-iyi-d ma iwet-d wenẓar.
Ttxil-m, ɣer-iyi-d uqbel ma tusid-d.
Ttxil-m, ur reẓẓem ara tazewwut-nni.
Ttxil-wen, ddut ɣer deffir n usakal.
Ttxil-wen, fket-iyi-d lkas n uyefki.
Ttxil-wen, ssakit-iyi-d ɣef tis sat.
Ttxil-wen, sṭebṭbet uqbel ma tudfem.
Ttxil-went, aznemt-iyi-t-id s lfaks.
Ttxil-went, dima tteqqnemt amsegdal.
Ttxil-went, qeflemt tibagusin-nwent.
Ttxil-went, ssizedget taxxamt-nwent.
Ttxil-wet init azul i yimawlan-nwen.
Ttzuxxun yimawlan n Yuba s mmi-tsen.
Tuččit-ik d aṭṭan-ik neɣ d talwit-ik
Tudert ɣezzifen i tutlayt tamaziɣt .
Tudert ɣezzifen i tutlayt taqbaylit!
Tufam iman-nwen deg uxeddim amaynut?
Tufamt iman-nwent amek ay teqqimemt?
Tufamt-d ayen ay tellamt tettnadimt.
Tuffɣa n leɛqel ur tenfiɛ i wacemma.
Tufiḍ-d taqcict ara taɣeḍ neɣ mazal?
Tufiḍ-iyi anda akken ur inuda yiwen.
Tuɣ ɣilleɣ yewɛer udlis-nni i tɣuri.
Tuɣ Sami yeffer deg uxxam n yemma-s.
Tuɣ tra ad tissin kra yellan fell-i.
Tuɣa-iyi deg Lundun ayyur lli izrin.
Tuɣal-d s axxam akken iɣaḍ-itt lḥal.
Tuɣ-d ṭumaṭic akked ifelfel azeggaɣ.
Tuɣemt tanumi ad truḥemt ɣer Boston?
Tuget ipanuyen-nni uran s tneglizit.
Tuget n tlawin ḥemmlent ad sewwqent.
Tugett di medden nwan-iyi d adarwic.
Tuḥwaǧeḍ aɣrum d tmergazt d ufermaj?
Tukerḍa n yedrimen d taɣawsa n diri.
Tum iṛuḥ ɣer Bustun tagrest iɛeddan.
Ṭum yezmer ad isiɣ israg s iḍuḍan-is
Tumer aṭas Naomi seg mi tewwi arraz.
Tumert-iw d ussan i sɛeddayeɣ yid-m.
Tura ad k-d-ḥkuɣ taqsiṭ n ddunit-iw.
Tura ad m-d-ḥkuɣ taqsiṭ n ddunit-iw.
Tura aql-iyi la ttwaliɣ seg tzewwut.
Tura attan d tanelmadt deg tesdawit.
Tura kan akka ad ak-d-awiɣ tafatuṛt.
Tura tudert teshel maḍi ɣef zik-nni.
Tura ur d-beddu ara imeṭṭawen a Tom.
Turew taɣaṭ-is tefka adɣes i lǧiran.
Tusa-d d tanatamt meqqren, neɣ xaṭi?
Tusa-iyi-d takti yelhan ugar imir-a.
Tusam-d akken ad tawim tinfulin-nni?
Tusid-d akken ad tawid tinfulin-nni?
Tusnelda tella d tameṭṭut n Arminio.
Tutlayt inu ɣuṛes azal ugar n tiyaḍ.
Tutlayt tamaziɣt tella deg Facebook.
Tutlayt taqbaylit teččur d timucuha.
Tutlayt taqbaylit tettnerni kra kra.
Tutlayt tarusit tecbeḥ, maca tewɛeṛ.
Tutlyin meṛṛa n ddunit kifkif-itent.
Tuwḍeḍ ɣer leɛmeṛ aydeg ara tdeɣreḍ?
Tuwḍeḍ-d deg teswiɛt-nni aydeg ddiɣ.
Tuweḍ ɣer usensu deg tlemmast n yiḍ.
Tuwyem-d iceḍḍiḍen n wenẓar yid-wen?
Tuzzya-a tesɛa yagi umuɣ n tmeṛjiwt.
Twet lehwa xemsa n wussan war aḥbas.
Twet-iyi s rrkel s aḍar-inu ayeffus.
Txaḍ-iyi-d yemma taqendurt tamaynut.
Txelleṣ-it Marie s ṛebɛa n idulaṛen.
Tycho yufa-d yiwen n yitri d amaynu.
Tzedɣeḍ deg Puṛtugal neɣ deg Brizil?
Tzedɣed deg Sasayama aseggas yezrin?
Tzedɣeḍ deg Sasayama aseggas yezrin?
Tzedɣemt ugar n useggas deg Ldzayer.
Tzemred ad d-tadfed, ma ulac aɣilif?
Tzemreḍ ad d-tafeḍ taxxamt i weltma?
Tzemred ad d-talsed i waya s leɛqel?
Tzemred ad d-temmektid i yiman-nnek.
Tzemred ad d-tesmetred asensu niḍen?
Tzemreḍ ad iyi-d-tefkeḍ akeffay-nni?
Tzemreḍ ad iyi-d-tesfehmeḍ asefru-a?
Tzemreḍ ad iyi-d-tiniḍ mi ara d-yas?
Tzemred ad iyi-d-treḍled asɣez-nnek?
Tzemred ad iyi-d-treḍled asɣez-nnem?
Tzemred ad iyi-d-trefded seg unafag?
Tzemreḍ ad iyi-tɛawneḍ ad t-id-afeɣ?
Tzemred ad iyi-teslemded tafṛensist?
Tzemred ad iyi-tessalyed ifecka-inu?
Tzemreḍ ad iyi-tessalyeḍ ifecka-inu?
Tzemred ad iyi-tessiwḍed ɣer unafag?
Tzemred ad iyi-treḍled akeryun-nnek?
Tzemred ad iyi-treḍled akeryun-nnem?
Tzemred ad iyi-tṣeggmed aselkim-inu?
Tzemred ad iyi-tṣeggmed irkasen-inu?
Tzemreḍ ad iyi-tṣeggmeḍ irkasen-inu?
Tzemred ad taɣed abrid ay ak-yehwan.
Tzemreḍ ad taɣeḍ abrid ay ak-yehwan.
Tzemred ad taɣed abrid ay am-yehwan.
Tzemreḍ ad taɣeḍ abrid ay am-yehwan.
Tzemreḍ ad tawyeḍ ayen ay ak-yehwan.
Tzemreḍ ad tawyeḍ ayen ay am-yehwan.
Tzemreḍ ad tcetkiḍ i uwanek aqbayli.
Tzemred ad tecced ayen ay ak-yehwan.
Tzemreḍ ad tecceḍ ayen ay ak-yehwan.
Tzemred ad tecced ayen ay am-yehwan.
Tzemreḍ ad tecceḍ ayen ay am-yehwan.
Tzemred ad teddud ɣef yifassen-nnek.
Tzemreḍ ad tedduḍ ɣef yifassen-nnek.
Tzemred ad teddud ɣef yifassen-nnem.
Tzemreḍ ad tedduḍ ɣef yifassen-nnem.
Tzemreḍ ad tedduḍ s axxam ma tebɣiḍ.
Tzemred ad teddud sanda ay ak-yehwa.
Tzemreḍ ad tedduḍ sanda ay ak-yehwa.
Tzemred ad teddud sanda ay am-yehwa.
Tzemreḍ ad tedduḍ sanda ay am-yehwa.
Tzemreḍ ad teffɣeḍ tura seg texxamt.
Tzemreḍ ad teɣreḍ aḍris-a s tseddi ?
Tzemred ad teɣred s tefṛensist, naɣ?
Tzemred ad teqqimed yid-i taswiɛt-a.
Tzemreḍ ad tesɛuḍ ayen i kem-yehwan.
Tzemred ad tesfeqded adad n umastal?
Tzemred ad tesɣemred sdeffir usensu.
Tzemred ad tesqedced tamkarḍit-nnes.
Tzemreḍ ad tezziḍ akkin alamma lsiɣ?
Tzemred ad tferned ini ay ak-yehwan.
Tzemreḍ ad tferneḍ ini ay ak-yehwan.
Tzemred ad tferned ini ay am-yehwan.
Tzemreḍ ad tferneḍ ini ay am-yehwan.
Tzemred ad tferned win ay ak-yehwan.
Tzemreḍ ad tferneḍ win ay ak-yehwan.
Tzemred ad tferned win ay am-yehwan.
Tzemreḍ ad tferneḍ win ay am-yehwan.
Tzemreḍ ad truḥeḍ ɣer din s teflukt.
Tzemred ad twalid itran s utiliskud.
Tzemred ad tzegred asif-nni s uɛumu?
Tzemreḍ ad yi-d-tawiḍ ayen ara ččeɣ?
Tzemreḍ ad yi-d-tawiḍ kra ad t-ččeɣ?
Tzemreḍ ahat ad iyi-trafqeḍ ukessar.
Tzemrem ad d-tesmetrem asensu niḍen?
Tzemrem ad iyi-d-treḍlem asɣez-nwen?
Tzemrem ad iyi-d-trefdem seg unafag?
Tzemrem ad iyi-tessiwḍem ɣer unafag?
Tzemrem ad tcetkim i uwanek aqbayli.
Tzemrem ad teddum ɣef yifassen-nwen.
Tzemrem ad tesɛum ayen i ken-yehwan.
Tzemrem ad tesqedcem tamkarḍit-nnes.
Tzemrem ad tgem akken ay awen-yehwa.
Tzemrem ad tgem ayen ay awen-yehwan.
Tzemremt ad aɣ-d-tḍebbremt tinfulin?
Tzemremt ad asent-taznemt taneḍfust?
Tzemremt ad d-tessuqqlemt tafyirt-a?
Tzemremt ad iyi-d-taznemt taneḍfust?
Tzemremt ad iyi-d-tḍebbremt tanfult?
Tzemremt ad iyi-d-tefkemt taɣenjayt?
Tzemremt ad iyi-t-id-terremt imir-a?
Tzemremt ad iyi-treqqɛemt irkasen-a?
Tzemremt ad iyi-tṣeggmemt irkasen-a?
Tzemremt ad tesxedmemt asegzawal-iw.
Tzemremt ad tfernemt ini ay tebɣamt.
Tzemremt ad tfernemt ini ay teɣsemt.
Tzemremt ad twalimt itran deg yiḍ-a?
U tteǧǧa-c amcic ayeffeɣ si heckaṛt.
Učči n usegnaf ur yelli ara igerrez.
Udfen-d akk ɣef tis mraw snat n yiḍ.
Ufan wuccanen ulli, eččan-tent akkw.
Ufiɣ-as-d aselmad n tefṛansit i Tom.
Ugadeɣ ad d-tewwet lehwa tameddit-a.
Ugadeɣ ur nettizmir ara ad k-nɛiwen.
Ugaɣ Mass Tanaka yuwey-d akayad-nni.
Ugaɣ ur la yetteddu ara usawal-nnek.
Ugaɣ ur la yetteddu ara usawal-nnem.
Ugaɣ ur la yetteddu ara usawal-nwen.
Uɣaleɣ ur sesseɣ ara ayefki s sskeṛ.
Uɣeɣ-d takerrust-a s ssuma meɛqulen.
Uɣiɣ-d yiwen n uzuɣar amaynut i mmi.
Ugur n n lweqt akter n win yidrimen.
Ugur netta ur nesɛi aṭas n yedrimen.
Ugur-nwent netta d assugget n wawal.
Uḥwaǧeɣ kra n yiwen d wi ara heḍṛeɣ.
Uḥwaǧeɣ kra n yiwet d wi ara heḍṛeɣ.
Uḥwaǧeɣ-k ad txedmeḍ yiwet n tɣawsa.
Ul ičča ani, iruḥ taɛebbuṭ-is tefreɣ
Ul ttnejjmeɣ ad xedmeɣ bla computer.
Ula d asawal ur t-tesɛi ara Taninna.
Ula d awal-a yekka-d seg tefṛensist.
Ula d ddunit tetteddu-yas di nnmara.
Ula d kecc tzemred ad d-tased yid-i.
Ula d kemm tzemred ad d-tased yid-i.
Ula d nekk la ttnuddumeɣ aṭas ass-a.
Ula d nekk liɣ mraw sa n yiseggasen.
Ula d nekk ukren-iyi tasnasɣalt-inu.
Ula d nekkni ad tfeǧǧeǧ tafukt-nneɣ.
Ula d targit ur yezmir ad yargu aya.
Ula d tussna maci d tussna tiseddit.
Ula d tutlayt-nnes ur tt-yessin ara.
Ula d tutlayt-nsen ur tt-ssinen ara.
Ula d yiwen mačči inuda ad yi-ifhem.
Ula d yiwen n uɣersiw ur t-tteddzeɣ.
Ula d yiwen seg-sen ur yulis iban-d.
Ula d yiwen ur d-ibedder tamurt-inu.
Ula d yiwen ur d-icekkeṛ tamurt-inu.
Ula d yiwen ur d-iwit deg tmurt-inu.
Ula d yiwen ur d-yusi ɣer tmurt-inu.
Ula d yiwen ur irezzu ɣef tmurt-inu.
Ula d yiwen ur t-id-sɛeddayeɣ seg-a.
Ula d yiwen ur t-mazal yettlaɛi-iyi.
Ula d yiwen ur yebɣi tasnasɣalt-nni.
Ula d yiwen ur yelli yesɛa tasiwant.
Ula d yiwen ur yelli yessen-it mliḥ.
Ula d yiwen ur yeqqar deg tmurt-inu.
Ula d yiwen ur yeqqar ɣef tmurt-inu.
Ula d yiwen ur yeqqim deg tmurt-inu.
Ula d yiwen ur yettamen s tmurt-inu.
Ula d yiwen ur yettḥuddu tamurt-inu.
Ula d yiwen ur yettqadar tamurt-inu.
Ula d yiwen ur yewhim anect-iw nekk.
Ula d yiwen ur yexdim deg tmurt-inu.
Ula d yiwen ur yeẓri anda ay tezdeɣ.
Ula d yiwen ur yeẓri anda ay yezdeɣ.
Ula d yiwen ur yeẓri anwa ay baba-k.
Ula d yiwen ur yeẓri anwa ay baba-m.
Ula d yiwen ur yumin ayen ay d-nniɣ.
Ula ma meɣɣer, maca mazal-it iṣeḥḥa.
Ula ma meẓẓiy, maca d imsujji uẓwir.
Ula ma yella d igellil, maca yefṛeḥ.
Ulac aɣilif ma ddiɣ yid-k ɣer uxxam?
Ulac aɣilif ma ddiɣ yid-m ɣer uxxam?
Ulac aɣilif ma keyyfeɣ? Ulac aɣilif.
Ulac aɣilif ma lsiɣ iceḍḍiḍen-nwent?
Ulac aɣilif ma qqimeɣ ɣer tama-nnek?
Ulac aɣilif ma qqimeɣ ɣer tama-nnem?
Ulac aɣilif ma rniɣ-d tanqiḍt niḍen?
Ulac aɣilif ma sneqseɣ-as i tiliẓri?
Ulac aɣilif ma sqedceɣ akeryun-nnek?
Ulac aɣilif ma sqedceɣ akeryun-nnem?
Ulac aɣilif ma sqedceɣ asawal-nwent?
Ulac aɣilif ma sqedceɣ aselkim-nnek?
Ulac aɣilif ma sqedceɣ aselkim-nnem?
Ulac aɣilif ma sqedceɣ aselkim-nwen?
Ulac aɣilif ma tcerked tadabut-nnek?
Ulac aɣilif ma tcerked tadabut-nnem?
Ulac aɣilif ma tcerkem tadabut-nwen?
Ulac aɣilif ma tɛawneḍ-iyi deg waya?
Ulac aɣilif ma teɣrid-as i yimsujji?
Ulac aɣilif ma tejjid-iyi ad ɛeddiɣ?
Ulac aɣilif ma tejjiḍ-iyi ad ɛeddiɣ?
Ulac aɣilif ma tekksed irkasen-nnek?
Ulac aɣilif ma tekksed irkasen-nnem?
Ulac aɣilif ma tekksem irkasen-nwen?
Ulac aɣilif ma tesɣam-iyi-d tanfult?
Ulac aɣilif ma tesɣid-iyi-d tanfult?
Ulac aɣilif ma tesneqsemt-as imesli?
Ulac aɣilif ma tɣelqed tazewwut-nni?
Ulac aɣilif ma tgezmed tayaziḍt-nni?
Ulac aɣilif ma tmedled tazewwut-nni?
Ulac aɣilif ma tuzned-t ɣer tansa-a?
Ulac aɣilif ma tuzneḍ-t ɣer tansa-a?
Ulac aɣilif ma tuznem-t ɣer tansa-a?
Ulac aɣilif ma tuznemt-iyi tabṛat-a?
Ulac aɣilif ma txellṣemt tafatuṛt-a?
Ulac aɣilif ma wwiɣ tasnasɣalt-nnek?
Ulac aɣilif ma wwiɣ tasnasɣalt-nnem?
Ulac aɣilif ma wwiɣ tasnasɣalt-nwen?
Ulac aɣilif ma yesbehdel-ik uselmad.
Ulac aɣilif. Eg akken ay awen-yehwa.
Ulac aɣilig ma tessexsiḍ ṛṛadyu-nni?
Ulac ayen ayɣef ara d-yili wemciweṛ.
Ulac ccekk dakken rewlent seg uxxam.
Ulac ccekk yella deg wexxam ass-nni.
Ulac d acu ara neg menɣir timeṛjiwt.
Ulac iḍ yelhan am win deg tudert-iw.
Ulac lfayda seg umennuɣ ɣef lbennat.
Ulamma ḥemmleɣ-k, tif-ik teṛwiḥt-iw.
Ulawumi amennuɣ yid-s ɣef usentel-a.
Ulayɣer ma neṛja-tt ugar n wanect-a.
Ulayɣer ma truḍ ɣef ukeffay ineɣlen.
Uliɣ isunan-nni yernu ddiɣ ad ḍḍseɣ.
Ultma-s ur tettṛuḥu ara ɣer Marikan.
Ulzuz n tafulin atan deg yir tegnit.
Umareɣ imi ay awen-d-lliɣ i lmendad.
Umareɣ imi ay kem-yeɛjeb uxxam-nneɣ.
Umareɣ imi ay kem-yeɛjeb uxxam-nteɣ.
Umareɣ imi ay ken-yeɛjeb uxxam-nneɣ.
Umareɣ imi ay ken-yeɛjeb uxxam-nteɣ.
Ungal n umaru Azwel-is yecvah nezah.
Ungal-a yessawal ɣef Wemgaru Aɣarim.
Unzen-as yimezrawen i tselmadt-nsen.
Unzent-as tmezrawin i uselmad-nsent.
Uqan wid yesseḥbibiren ɣef teqbaylit
Ur aɣ-ixuṣṣ ara upitṛul deg tmurt-a.
Ur aɣ-yeǧǧi ara unẓar-nni ad neffeɣ.
Ur akk ayen yettemcebruruqen d ureɣ.
Ur asen-bdident mliḥ i warraw-nsent.
Ur asen-d-sseknafeɣ tireẓwiyin-nsen.
Ur asen-kkateɣ iɣfawen-nsen s aɣrab.
Ur asen-ssawaḍeɣ arraw-nsen s axxam.
Ur asent-d-ssiliɣeɣ ixeddamen-nsent.
Ur asent-d-ttḍeggireɣ iɣmisen-nsent.
Ur asen-tebdided mliḥ i warrak-nnem.
Ur asen-tebdided mliḥ i warraw-nnek.
Ur asen-tebdideḍ mliḥ i warraw-nnek.
Ur asen-tebdideḍ mliḥ i warraw-nnem.
Ur asen-tebdidem mliḥ i warraw-nwen.
Ur asen-temliḍ ara d acu ara xedmen.
Ur asent-neɣɣeɣ lmal-nsent seg rrif.
Ur asent-ssembaɛadeɣ isihaṛen-nsent.
Ur asent-ssissineɣ tigargucin-nsent.
Ur asent-sskarayeɣ tiṛakniwin-nsent.
Ur asen-ttbayaɛeɣ i yifesyanen-nsen.
Ur asen-ttbayaɛeɣ i yiserjanen-nwen.
Ur asen-ttɛawadeɣ assersi n Windows.
Ur asen-ttɛawadeɣ i yigaṛajen-nsent.
Ur asent-ttakleɣ ɣef yiḍarren-nsent.
Ur asent-ttazneɣ tiftarin-a s ufaks.
Ur asent-ttdemmireɣ takeṛṛust-nsent.
Ur asent-ttderrireɣ tuccḍiwin-nsent.
Ur asent-ttɛawaneɣ imsewwiyen-nsent.
Ur asent-ttḥeddideɣ iceḍḍiḍen-nsent.
Ur asent-ttmelliḥeɣ iḍebsiyen-nsent.
Ur asent-ttqeccimeɣ ifenjalen-nsent.
Ur asent-ttṛekkibeɣ iselkimen-nsent.
Ur asent-ttṣeggimeɣ takeṛṛust-nsent.
Ur asent-ttwenniteɣ imagraden-nsent.
Ur as-nettarra sskeṛ i teɣlust-nneɣ.
Ur as-nettarra sskeṛ i teɣlust-nteɣ.
Ur as-tesliḍ la tessawal tafṛensist?
Ur as-tettarra sskeṛ i teɣlust-nnes.
Ur as-ttekkseɣ iɣsan i uzemmur-nsen.
Ur as-ttekkseɣ iɣsan i uzemmur-nwen.
Ur as-yenni acemma ara tt-yesserfun.
Ur as-yettarra sskeṛ i teɣlust-nnes.
Ur aṭas aya seg wasmi ay yezwej Tom.
Ur awen-d-sseknafeɣ tireẓwiyin-nwen.
Ur awen-kkateɣ iɣfawen-nwen s aɣrab.
Ur awent-d-ssiliɣeɣ ijenyuṛen-nwent.
Ur awent-messleɣ tisura-nwent n USB.
Ur awent-slemden acemma deg uɣerbaz?
Ur awent-ssegrareɣ tinelmadin-nwent.
Ur awent-ssenqaseɣ deg lexlaṣ-nwent.
Ur awent-sskarayeɣ tiṛakniwin-nwent.
Ur awent-ttbeddileɣ iceḍḍiḍen-nwent.
Ur awent-ttɛawaneɣ tiqeddacin-nwent.
Ur awent-ttqeccimeɣ iḍebsiyen-nwent.
Ur awent-ttwenniteɣ imagraden-nwent.
Ur beɣɣuɣ ara ad mahleɣ deg usbiṭar.
Ur beɣɣuɣ ara ad mahleɣ deg usegnaf.
Ur beɣɣuɣ ara ad xedmeɣ deg usbiṭar.
Ur bɣiɣ ad am-d-ssutreɣ ad kem-aɣeɣ!
Ur bɣiɣ ad iyi-sserɣen mi ara mmteɣ.
Ur bɣiɣ ad k-ɛelleleɣ s wuguren-inu.
Ur bɣiɣ ad xeṣreɣ deg yikayaden-inu.
Ur bɣiɣ ara ad ččeɣ dagi tameddit-a.
Ur bɣiɣ ara ad d-ssuqqleɣ tafyirt-a.
Ur bɣiɣ ara ad mmeslayeɣ yid-k tura.
Ur bɣiɣ ara ad qerrbeɣ aṭas ɣur-sen.
Ur bɣiɣ ara ad ṛuḥeɣ ɣer tmeɣṛa-nni.
Ur bɣiɣ ara ad xeyybeɣ imidiwen-inu.
Ur bɣiɣ ara akka ad xedmeɣ annect-a.
Ur bɣint ad d-ssiwlent ɣef wanect-a.
Ur ččiɣ acemma seg yiḍelli taṣebḥit.
Ur ččiɣ ara akk timẓidin timecṭuḥin.
Ur cfiɣ ara ayɣeṛ i d-usiɣ ɣer dagi.
Ur cikkeɣ ara ad d-awin akayad-nsen.
Ur cikkeɣ ara ad d-tawi akayad-nnes.
Ur cikkeɣ ara ad d-yawi akayad-nnes.
Ur cikkeɣ ara ad yili uecfa fell-as.
Ur cikkeɣ ara nitenti d tibugaṭutin.
Ur cukkeɣ ara belli tesɛiḍ taluft-a.
Ur cukkeɣ ara belli yessen taɛebrit.
Ur da asent-ssukkufeɣ lbaṭaṭa-nsent.
Ur da asent-ttaḍreɣ ilejjigen-nsent.
Ur da nlul inafaln, ad naɣul inafaln
Ur da tseḍsa tmacahut-nnek ay arba !
Ur d-cliɛeɣ ara deg ayen i txeddmeḍ.
Ur d-cliɛeɣ ara deg ayen i txeddmem.
Ur d-cligeɣ ara ma semmeḍ lḥal cwiṭ.
Ur d-cligeɣ ara seg tiḥḥercewt-nnes.
Ur d-cligeɣ seg wayen ay tettxemmim.
Ur d-cligeɣ seg wayen ay ttxemmimen.
Ur d-cligeɣ seg wayen ay yettxemmim.
Ur deg lbaṭel ay yedda ɣer tesdawit.
Ur d-faqeɣ ara ma tellamt tukumit-d.
Ur d-faqeɣ ara yakk ma din i telliḍ.
Ur d-itrebbeḥ kra win yeqqimen dayi.
Ur d-mazal ara yetteddu uselkim-nni.
Ur d-mezgeɣ ara nekk d yinaragen-iw.
Ur d-mmektiɣ acemma niḍen taswiɛt-a.
Ur d-nniɣ ara d tamdakelt-ik i lliɣ.
Ur d-nniɣ ara d tamdakelt-im i lliɣ.
Ur drus n yiɣisem ay teswiḍ a argaz.
Ur d-ssuqqleɣ ula d yiwet n tefyirt.
Ur d-tennid amek ara teddud ɣer din.
Ur d-tenniḍ amek ara tedduḍ ɣer din.
Ur d-tennim amek ara teddum ɣer din.
Ur d-terbiḥem ula d yiwet n tenqiḍt.
Ur d-tettas ara ula deg wass n lɛid.
Ur d-tettbineḍ ara d tin yetḥeyyren.
Ur d-ttasen ara ula deg wass n lɛid.
Ur d-ttekkseɣ tiṭṭawin-inu seg-sent.
Ur d-ttekkseɣ tiṭṭawin-inu seg-went.
Ur d-ttekkseɣ udi seg ukeffay-nwent.
Ur d-ttinin medden tiɣawsiwin am ti!
Ur d-usint ara ɣef lǧal n tezwawaḍt.
Ur d-yeqqim ara akk yiferki n ubduz.
Ur d-yettas ara ula deg wass n lɛid.
Ur d-yufi ara abrid ara t-yessufɣen.
Ur d-yusi s axeddim s tkeṛṛust-nnes.
Ur ɛad yekcim agdud yidles n tugdut.
Ur ɛad ẓriɣ dacu i ilaqen ad yemmag.
Ur ɛerreḍ ara ad tged aya deg uxxam.
Ur ɛriḍeɣ ara ad jerḥeɣ kra n yiwen.
Ur fell-i ad dduɣ ɣer dinna iman-iw.
Ur fessus ara ad teǧǧed leɛyub-nnek.
Ur fessus ara ad teǧǧed leɛyub-nnem.
Ur ggar iman-ik deg ayen i k-yexḍan!
Ur ɣɣaseɣ ara ad mahleɣ deg usbiṭar.
Ur ɣɣaseɣ ara ad mahleɣ deg usegnaf.
Ur ɣɣaseɣ ara ad xedmeɣ deg usbiṭar.
Ur ɣriɣ ula d yiwet seg tebṛatin-is.
Ur ɣseɣ ara ad d-ssuqqleɣ tafyirt-a.
Ur ɣseɣ ara ad xeyybeɣ imidiwen-inu.
Ur ḥemmleɣ ara ad cnuɣ s tefransist.
Ur ḥemmleɣ ara ad ɛummeɣ deg ugaraw.
Ur ḥemmleɣ ara tiẓẓidanin tiquṛanin.
Ur ḥeqṛet ara times, akal, aman, aḍu
Ur ḥnuccḍeɣ ara makken yekkat ugris.
Ur ḥnuccḍen ara makken yekkat ugris.
Ur ḥsiɣ ara ad yili d asaru imeɛnen.
Ur iḥemmel ara ad yessikel s usafag.
Ur iḥnucceḍ ara makken yekkat ugris.
Ur ilaq ara ad kunt-iɣiḍ akken lḥal!
Ur ilaq ara ad tefkeḍ laman deg Tom.
Ur ilaq ara ad terẓeḍ awal i baba-m.
Ur ili ljehd akken ad d-yini acemma.
Ur issaweḍ ara swayes ara yaɣ axxam.
Ur iwiḍeɣ ad akzeɣ mamek as-sskareɣ.
Ur iyi-d-ɛriḍen ara ɣer tmeɣra-nsen.
Ur iyi-d-ɛriḍent ara ɣer tmeɣra-nni.
Ur iyi-d-iṣaḥ ara ad ẓṛeɣ asaru-nni.
Ur iyi-d-mazal ara d ameddakel-nnek.
Ur iyi-d-mazal ara d ameddakel-nwen.
Ur iyi-d-ttmuqqul s tmuɣli-a n ccek!
Ur iyi-d-yeqqim wacemma ad t-xedmeɣ.
Ur iyi-teǧǧi ara tegnit ad k-ɛawneɣ.
Ur iyi-terri tmara ad d-iniɣ acemma.
Ur iyi-yeǧǧi ara unẓar-nni ad ffɣeɣ.
Ur iyi-yeǧǧi ara uẓɣal-nni ad ḍḍseɣ.
Ur izgi ara yetteffeɣ zik seg uxxam.
Ur jeddleɣ ad ɛerḍeɣ ayen-nni daɣen.
Ur k-bɣiɣ ara deg wammas-iw anezzan.
Ur kent-neṣṣḥeɣ ad d-tesɣem axxam-a.
Ur kent-tthenniɣ seg yeɛdawen-nwent.
Ur k-terri ara tmara ad ttettixeṛed.
Ur k-terri tmara ad t-tfakeḍ azekka.
Ur k-ttajjaɣ ad teddud i yiman-nnek.
Ur k-ttajjaɣ ad tedduḍ i yiman-nnek.
Ur k-ttajjaɣ i yiman-nnek akked Tom.
Ur la awent-sselmadeɣ ara tanglizit.
Ur la kent-ttarraɣ ara d tigellinin.
Ur la ssengareɣ ara tiɣuliyin-nwent.
Ur la yetteddu ara mliḥ uselkim-nni.
Ur leddit ara alamma teḥbes tmacint.
Ur liɣ ula d yiwet n tuɣmest yerkan.
Ur lliɣ ara akk ẓriɣ dakken tzewǧeḍ.
Ur lliɣ ara deg uxxam iḍelli deg iḍ.
Ur lliɣ ara ẓriɣ d acu ara d-yeḍrun.
Ur lliɣ ara ẓriɣ d acu ara xemmemeɣ.
Ur lliɣ nekk d tawessart wala kenwi.
Ur lliɣ zemreɣ ad rnuɣ acemma niḍen.
Ur llin ara ẓran ula sanda ara rren.
Ur llin aṭas n tkeṛṛusin deg webrid.
Ur llin zemren ad gen taɣawsa am ta.
Ur llint ara ttɛumunt deg teftist-a.
Ur llint ara ttẓallant deg tmesgida.
Ur llint ssexṣarent iceḍḍiḍen-nsent.
Ur nebɣi ad d-nessiwel ɣef wanect-a.
Ur nelli ara nettɛumu deg teftist-a.
Ur nelli ara nettẓalla deg tmesgida.
Ur nelli nessawaḍ igerdan s aɣerbaz.
Ur nessawal ara ɣef waya deg usawal.
Ur nessin acemma ɣef twacult n Mary.
Ur netteddu ara d igerdan s aɣerbaz.
Ur netteddu ara d warrac ar uɣerbaz.
Ur netteddu ɣer uɣerbaz ass n ssebt.
Ur nettṣeddiq ara i win yekfa Ṛebbi.
Ur nezmir ad nernu agil i teḍreẓt-a.
Ur nezmir ad nexdem ma ulac trisiti.
Ur nezmir ad nḥettem medden ɣef aya.
Ur nezmir ara ad nesqerdec ɣef waya?
Ur neẓri aṭas n yizerzren deg teẓgi.
Ur neẓri d acu ay la tettnadi Marie.
Ur nli akud akken ad neg aya imir-a.
Ur nsell aṭas n yisalan ɣef Aṛminya.
Ur nwiɣ ara ad neḥwij tallalt n Tom.
Ur nwiɣ ara tessneḍ akka tafransist.
Ur nwiɣ ara teẓṛiḍ acḥal i k-cedhaɣ.
Ur nẓimeɣ la deg-k wala deg yemma-k.
Ur qebbleɣ ara ula d yiwet n tsebba.
Ur qeṭṭeɛ ara layas a Cabḥa a yelli.
Ur qniɛeɣ ara s tɣara n leqdic-nwen.
Ur qqaremt ara tabrat zdat n medden.
Ur ṛejjem ara taydit-nni s yidɣaɣen.
Ur ṛejjmemt ara aydi-nni s yidɣaɣen.
Ur riɣ ad greɣ iman-inu deg wuguren.
Ur riɣ ara akk ad qqleɣ ɣer tkurmut.
Ur rriɣ iman-inu amzun ur tent-ẓriɣ.
Ur sɛiɣ acemma ara d-iniɣ mgal waya.
Ur sɛiɣ acemma ara d-iniɣ taswiɛt-a.
Ur sɛiɣ akud akken ad waliɣ tiliẓri.
Ur sɛiɣ ara ayen i ɣef i yettqellib.
Ur sɛiɣ ara idrimen ɣur-i taswiɛt-a.
Ur sɛiɣ ara lweqt ad nnaɣeɣ yid-wen.
Ur sɛin aṭas n yedrimen am gma-tsen.
Ur semḥas ara yark iwayen id yeqqar.
Ur semmeḍ ara lḥal sdaxel uxxam-nni.
Ur sineɣ ara ad aruɣ s ufus azelmaḍ.
Ur sineɣ ara ad meslayeɣ tafransist.
Ur srusuy ara iɣemran-ik ɣef ṭṭabla.
Ur ssawal ed unehhaṛ mi ara inehheṛ.
Ur ssawalent s tanglizit deg wexxam.
Ur ssawḍeɣ ad fehmeɣ d acu ay tebɣa.
Ur ssawḍeɣ ad t-sqenɛeɣ aya d tidet.
Ur ssawḍeɣ ara ad d-afeɣ asensu-nni.
Ur ssawḍeɣ ara ad d-ḍebbreɣ tanfult.
Ur ssawḍeɣ ara ad ssedduɣ aselkim-a.
Ur ssawḍen ara ad d-afen asafag-nni.
Ur ssawḍent ad d-afent axxam n Mary.
Ur ssewliwilet ara akk ifassen-nwen.
Ur ssineɣ acemma ɣef twacult n Mary.
Ur ssineɣ amek ara sqedceɣ Facebook.
Ur ssineɣ ara ad mmeslayeɣ taṭurkit.
Ur ssineɣ ara amek ara ẓẓgeɣ taɣaḍt.
Ur ssineɣ ara leṣnaf-agi n yimdanen.
Ur ssineɣ uma d yiwen deg taddart-a.
Ur ssinen acemma ɣef twacult n Mary.
Ur stufaɣ ara ad d-sfehmeɣ s ufatus.
Ur stufaɣ ara ad d-ssegzuɣ s ufatus.
Ur stufaɣ ara ad geɣ ayen-nni ass-a.
Ur tebɣi ad d-tessiwel ɣef wanect-a.
Ur tebɣid ad teddud s aɣerbaz ass-a.
Ur tebɣiḍ ad tedduḍ s aɣerbaz ass-a.
Ur tebɣiḍ ara ad irbeḥ Tom, neɣ ala?
Ur tebɣiḍ ara ad tt-teǧǧeḍ tettraju!
Ur tebɣid ara ula d tisin ad d-asen?
Ur tebɣim ad teddum s aɣerbaz ass-a.
Ur tebɣim ara ad irbeḥ Tom, neɣ ala?
Ur tebɣimt ad d-tessiwlemt ɣef waya.
Ur tebɣimt ara ad tledyemt tazewwut.
Ur tebɣimt ara ad treẓmemt tazewwut.
Ur tɛeḍḍel tennum tudert deg yeɣrem.
Ur tefrin ara ad teffeɣ d tafremlit.
Ur teɣsed ara ula d tisin ad d-asen?
Ur teɣsemt ara ad tledyemt tazewwut.
Ur teɣsemt ara ad treẓmemt tazewwut.
Ur telli ara tettɛumu deg teftist-a?
Ur telli ara tettẓalla deg tmesgida.
Ur telli deg uxxam wala deg uɣerbaz.
Ur telli tessawaḍ igerdan s aɣerbaz.
Ur tellid ara d anfaras akk anect-a!
Ur tellid tessaẓayed tibalizin-nnek.
Ur telliḍ tessaẓayeḍ tibalizin-nnek.
Ur tellid tessaẓayed tibalizin-nnem.
Ur telliḍ tessaẓayeḍ tibalizin-nnem.
Ur tellim tessaẓayem tibalizin-nwen.
Ur tellimt ara tnehhṛemt afurgu-nni.
Ur tellimt tessalqayemt imerjan-nni.
Ur ten-mazal ara bennun-tent am zik.
Ur ten-mazal ara ṣekken-tent am zik.
Ur tennumeḍ ara tesseḍ aṭas n waman.
Ur tennumemt ara tetteffɣemt deg iḍ.
Ur terri ara tmara ad tzerwed ass-a.
Ur terri tmara ad t-nawey s asbiṭar.
Ur tesɛi iɣef ara d-tɛeyyeḍ fell-ak.
Ur tesɛi iɣef ara d-tɛeyyeḍ fell-am.
Ur tesɛid ara akk azref ad tilid da.
Ur tesɛim ara akk azref ad tilim da.
Ur tessawalemt ara taspenyulit, naɣ?
Ur tessaweḍ ad teldey taqerɛunt-nni.
Ur tessaweḍ ara ad as-tɣer s usawal.
Ur tessin acemma ɣef twacult n Mary.
Ur tessined ad tessiwled tafṛensist?
Ur tessineḍ ara ad txedmeḍ tasertit.
Ur tessineḍ talmanit neɣ tessneḍ-tt?
Ur tessinem ara ad txedmem tasertit.
Ur tessinem talmanit neɣ tessnem-tt?
Ur tessinemt ara ad turaremt ddabex.
Ur teswi kra tudert-iw ma ur telliḍ.
Ur tettalased ara ad trekḍed ilugan.
Ur tetteddumt ed yigerdan s aɣerbaz.
Ur tettɛeḍḍileḍ ad tebduḍ imeṭṭawen.
Ur tetteɣ ara deg wexxam tameddit-a.
Ur tettemsegzu ara akk akked ukerwa.
Ur tettɣimimt ara ad teččemt imensi?
Ur tettu ara d akken akud d idrimen.
Ur tettut ara ad tɛeddim ɣer tḥanut.
Ur tettut ara belli tefkam-iyi awal!
Ur tewwiḍ ara aɣyul ad d-isew ass-a?
Ur tezmireḍ ad d-tesɣeḍ anezraf-nni.
Ur tezmireḍ ad tsemmḥeḍ deg tirga-k.
Ur tezmired ara ad ten-tled deg sin.
Ur tezmireḍ ara ad tesxedmeḍ ayla-s.
Ur tezmirem ara ad tawim amahil-inu.
Ur tezmirem ara ad ten-tlem deg sin.
Ur tezmirem ara ad tesxedmeḍ ayla-s.
Ur tezmiremt ad tetḥeqqemt ɣef waya.
Ur tezmiremt ad tgemt acemma imir-a.
Ur tezmiremt ad tgemt laman deg Tom.
Ur tezmiremt ara ad iyi-tjemɛemt da.
Ur tezmiremt ara ad teččemt yid-neɣ?
Ur teẓri amek ara d-tkafi iman-nnes.
Ur teẓri d acu ay la tettnadi Marie.
Ur teẓrid ara sanda ay la tetteddud.
Ur teẓrid maɣef ay iɣab deg uɣerbaz?
Ur teẓrim ara sanda ay la tetteddum.
Ur tḥaceḍ ara taqcict deg ddunit-ik?
Ur tḥemmleḍ ccikula neɣ tḥemmleḍ-tt?
Ur tḥemmlem ccikula neɣ tḥemmlem-tt?
Ur tlid ara azref ad trekḍed ilugan.
