Mi d-qqleɣ, ur d-ufiɣ takeṛṛust-inu.
Mi d-tuki Marie, tella qrib d ttnac.
Mi d-tusa ɣur-neɣ, d acu i aɣ-tenna?
Mi medleɣ akk tiwwura, ddiɣ ad gneɣ.
Mi rziɣ fell-as, ufiɣ-t yesɛa ccɣel.
Mi tɛedda ssaɛa, terna tzad tawla-s.
Mi tella deg Tuṛuft, terza ɣef Roma.
Mi tfakkeḍ kan učči sired tuɣmas-ik.
Mi tfakkeḍ kan učči sired tuɣmas-im.
Mi tfuk ucci, teɣra cwiṭ n tjapunit.
Mi t-ẓriɣ, iban-iyi-d ur t-yuɣ wara.
Mi uwḍeɣ s axxam, kkseɣ irkasen-inu.
Mi walan itri-nni, mmuten seg lfeṛḥ.
Mi yeɛya yeqqim fell-as ad yesgunfu.
Michael werɛad ur yessefqed tiwwura.
Mick isemma-as i ulufan-nni Richard.
Mira werɛad ur txelleṣ tafatuṛt-nni.
Mlaleɣ-t-id mi d-uɣaleɣ seg uɣerbaz.
Mlaleɣ-tt-id yiwet n tikkelt weqbel.
Mlemt-iyi-d anwa deg-sen ara ferneɣ.
Mlet-as anwa ay d asakal ara teḍḍef.
Mlet-iyi-d amek ara dduɣ ɣer unafag.
Mlet-iyi-d anta deg-sent ara ferneɣ.
Mlet-iyi-d anwa deg-sent ara ferneɣ.
Mmugreɣ-t-id mi d-qqleɣ seg uɣerbaz.
Mmuqqel adlis-nni yersen ɣef ṭṭabla.
Mmuqqel d acu ay tzemred ad d-tafed.
Mmuqqel ɣer tkeṛṛust-ihin taddalant.
Mmuqqel ɣer yitri-inna yettfeǧǧiǧen.
Mmuqqlemt kan takeṛṛust-iw tamaynut.
Mmuqqlemt ziɣ takeṛṛust-iw tamaynut.
Mmuteɣ seg laẓ. Melmi akka ara necc?
Mraw n tedqiqin aya seg mi ay tebda.
Mraw n yiseggasen d tallit ɣezzifen.
Muqleɣ ar saɛɛa, walaɣ-tt iruḥ lḥal.
Muqleɣ ar seɛɛa, walaɣ-tt iruḥ lḥal.
Muqqel anda i tesrusuyeḍ iḍaṛṛen-ik.
Muqqel anda i tesrusuyeḍ iḍaṛṛen-im.
Muqran ileḥḥu yeshetrif abrid-abrid.
Myefkan taqemmuct widak yemḥemmalen.
Nadimt deg Google ad ahat ad tafemt.
Nancy teḥṛes iman-nnes deg tezrawin.
Nbeddel-d timseknewt-nneɣ s tgiṭart.
Nbeddel-d timseknewt-nteɣ s tgiṭart.
Ndemmeɣ ur s-yennan ara tidet i Tom.
Nebded ɣef tewwurt, neqqim nettṛaju.
Nebɣa ad k-nɛawen acku tuklaled aya.
Nebɣa ad nekru tamudrut deg temdint.
Nebɣa ad nqiss adad-nnek n yidammen.
Nebɣa ad nqiss adad-nnem n yidammen.
Nebɣa ad teqqimeḍ, imi tɣesbeḍ, ruḥ.
Nebṭel tuffɣa-nneɣ ɣef lǧal n unẓar.
Necca imekli deg texxamt n temlilit.
Nečča tapizza ed uyaziḍ ɣer yimekli.
Nedda ɣer wefrag ad nurar abaseball.
Neḍḍef asafag seg Mexico ɣer Madrid.
Neḍḍef asafag seg Tokyo ɣer Sapporo.
Nedmeɣ imi ay ak-d-giɣ uguren-a akk.
Nedmeɣ imi ay am-d-giɣ uguren-a akk.
Neɛreḍ ad ten-nessusem, ur nessaweḍ.
Neɛya nessusum armi ɣallen neggugem!
Neffeɣ, ɣas akken la yekkat ugeffur.
Nefren asensu iqerben ɣer yisalayen.
Neɣtes ad t-neǧǧ weḥd-s kta n lweqt.
Neḥčun yemma-twen a arraw n ubekkaḍ.
Nekk ad d-iniɣ ad iwet unẓar azekka.
Nekk d axeddam da. Ur lliɣ d inebgi.
Nekk d talmanit, wama kecc d amaziɣ.
Nekk ed Lucy nesɛa aṭas n tmeddukal.
Nekk ɣur-i bezzaf tleqqem lqahwa-yi.
Nekk lliɣ ttekleɣ ad teddud yid-neɣ.
Nekk s yiman-iw, meslayeƔ d uneƔlaf.
Nekk sleɣmaɣ akked yiɣallen usligen.
Nekk ssarameɣ ad leɣ takatut yelhan.
Nekk taddart-iw d Tawrirt At Mansuṛ.
Nekk ur riɣ ara ad as-beddeɣ i uydi.
Nekk xedmeɣ aked Massa Marie Fisher.
Nekka ass s lekmal-nnes deg teftist.
Nekka kraḍ n yiseggasen deg tkurmut.
Nekkenti ɣezzifit anect n baba-tneɣ.
Nekkenti nedder deg umtiweg n Wakal.
Nekkni d imariren n tkurt n uqecwal.
Nekni mazal ad neṭṭef deg awal-nneɣ.
Nella nebɣa ad nẓer kullec ɣef Mary.
Nella nedder akk deg yiwen n usensu.
Nella neskeṛ, ama d nekk, ama d Tom.
Nella nesred, ur la nettewliwil ara.
Nella nettaḍḍaf deg yimenzayen-nneɣ.
Nella nettaḍḍaf deg yimenzayen-nteɣ.
Nella nettbeddil-as ṛṛay-nnes i Tom.
Nella nsett imekli n tnezzayt daxel.
Nella ntteddu ed yigerdan s aɣerbaz.
Nella nugad ad nezgel tamacint-nneɣ.
Nella nugad ad nezgel tamacint-nteɣ.
Nella ur nezmir ad neddu d tmeẓla-s.
Nensa deg usensu ay d-yessemter Tom.
Neqqar argaz d argaz, teqqur tasa-s.
Neqqel ur nettamen ara s tmurt-nneɣ.
Neqqim ɣef yifadden akken ad neẓẓal.
Nesɛa amcic yerna nḥemmel akk imcac.
Nesɛa aṭas n wedfel da, deg tegrest.
Nesɛa azref ad nedder anda ay nebɣa.
Nesɛa azref ad nezdeɣ anda ay nebɣa.
Nesɛa deg-sen kuẓ-temrawin d semmus.
Nesɛa yiwen n umcic ed yiwen n uydi.
Nesɛedda tiswiɛin yelhan deg Boston.
Nesfugul Tafaska n Yitran deg Yulyu.
Nesɣa-d tamacint n tarda d tamaynut.
Neskeṛ ama d tiwwura, ama d tizewwa.
Nessaram teɛjeb-ikem tɣimit-nnem da.
Nessaram teɛjeb-iken tɣimit-nwen da.
Nessawal sin n yilsawen ibeṛṛaniyen.
Nessaweḍ ad nezger asif-nni s uɛumu.
Netflix atan yewjed tura deg Tuṛuft.
Netta am tata, ur yesɛi yiwen wudem.
Netta d aqcic i yesɛan aṭas n tirga.
Netta ila yiwet n tfelwit n Picasso.
Netta mačči d ameṛkanti maca ihenna.
Netta meɣɣer, zur yernu dima yecɣel.
Netta meẓẓiy, bitt ahat meẓẓiy aṭas.
Netta ur d aselmad, wanag d anelmad.
Netta ur d imsujji, wanag d afremli.
Netta ur ɣezzif ara anect n dadda-s.
Netta yeqqar-d s ẓẓher kan i yerbeḥ.
Netta yerra lwelha-nnes ɣer tsertit.
Netta yettwannigsemma Izem N Ǧerǧer.
Netta yezmer ad yeṛju arma d azekka.
Nettat d taqcict, nettat d tameṭṭut.
Nettat tettxemmim kan ɣef teqbaylit.
Nettat tugar weltma-twen deg teɣzef.
Nettat ur telli da, tedda ɣer Paris.
Nettat ur tezmir ara ad teg ccɣel-a.
Nettat ur turim ara ad teffer tidet.
Nettemsefham mliḥ gar-aneɣ deg kraḍ.
Netteqqen qrib yal ass ɣer Internet.
Nettxatal deg ubrid amzun d uccayen.
Nezdeɣ acḥal n yiseggasen deg tmurt.
Nezdeɣ sdat temkarḍit-nni tameqrant.
Nezmer ad neddu ɣer wexxam ɣef uḍar.
Nezmer ad nernu akeffay i teɣlust-a.
Nezmer ad neskeṛ tawwurt-a s tsarut?
Nezmer ad nexdem ɣef aya tura yakan.
Nezmer akk ad nessiwel s tefṛensist.
Neẓṛa belli kenwi mačči d iɛeggunen.
Neẓra ur akka ay yessefk ad neg aya.
Nɣawel akken ad d-neqḍeɛ asakal-nni.
Nḥeṛṛ amcic-nni ɣer yiwet n teḥnact.
Nitenti ɣezzifit anect n baba-tsent.
Nitenti seg yiwet n twacult meɣɣren.
Nitni llan dima tturaren atennis da.
Nkemmel deg uskasi armi ineṣṣef yiḍ.
Nnan tajniwt teqqwa tella ad tewwet.
Nnan-ak ara ara d-tili temlilit-nni?
Nnan-d dakken nedmen ɣef uɣtas-nsen.
Nnan-d dakken xali-s imuhel ɣer-sen.
Nnan-d llan bɣan ad ṛuḥen ad d-qḍun.
Nnan-d ur ḥemmlen ara ad xedmen aya.
Nnan-iyi-d ad teqqimed i yiman-nnek.
Nnan-iyi-d ad teqqimeḍ i yiman-nnek.
Nnan-iyi-d ad teqqimed i yiman-nnem.
Nnan-iyi-d ad teqqimeḍ i yiman-nnem.
Nnan-iyi-d kecc d ameṛkanti ameqran.
Nnant-d d akken tella d tamerkantit.
Nniɣ i Ṭum ayenna akkw ɣifs snaɣseɣ.
Nnig lǧifa-nni llan ddawaren yisɣan.
Nnig waya, yessefk ad tettemɛawanem.
Nnig waya, yessefk ad tettemyalalem.
Nniɣ-as ad t-sfunnceɣ yerna giɣ aya.
Nniɣ-as i wemsaltu-nni ayen ay ẓriɣ.
Nniɣ-as ur yettɛawad ara ad iɛeṭṭel.
Nniɣ-asen d akken ur k-d-qqaṛen ara.
Nniɣ-asen d akken ur m-d-qqaṛen ara.
Nniɣ-awent yagi aya tamiḍi n tikkal.
Nnummeɣ setteɣ imekli n tnezzayt da.
Nnummeɣ ttaḍḍaseɣ ɣef tizi n leḥdac.
Nnummeɣ ttlusuɣ irkasen d iberkanen.
Nnummeɣ ttqeṣṣireɣ yid-s deg usakac.
Nra ad nwali isafagen mi ara qelɛen.
Nsemma-as i memmi ɣef yisem n jeddi.
Nudaɣ fell-asent anda ara tent-afeɣ.
Nuɣal nennum nxeddem arma iṛuḥ lḥal.
Nuɣ-d ya kan s kra n wayen i neḥwaj.
Numar imi ay k-nla deg tneɣrit-nneɣ.
Nutni ttemttaten ɣef yisem n tlelli.
Nwiɣ yessen ad iɛum, ziɣen walu akya
Nzellu ufrik yal tafaska tameqqrant.
Peter yeɣli deg tayri n teqcict-nni.
Pfirsichbaeumchen terraru s tmaziɣt.
Pulunya ttinin-as Polska s tpulunit.
Qarnemt tiririt-nwent ɣer tin n Tom.
Qebleɣ ayen i d-yessuter war akukru.
Qelɛen akk ar tmazirt qeccuc meccuc.
Qemmrent s tmeddurin-nsent ɣef waya.
Qeṣṣren ɣef ayen iḍeṛṛun deg umaḍal.
Qis talaba-nnek i lmend n yiri-nnek.
Qqen tiṭṭawin-nnek kraḍt n tesdidin.
Qqimeɣ kraḍ n yimalasen deg usegnaf.
Qqimeɣ la ttṛajuɣ da snat n tsaɛtin.
Qqimeɣ ttṛajuɣ-tt tameddurt-inu akk.
Qqiment deg yiwen n usensu n ulameɣ.
Qqiment kra n tuttriwin war tiririt.
Qqiment, zzint-d i tdabut n tenwalt.
Qqleɣ ur ḥwajeɣ ad qqneɣ tisekkadin.
Qqleɣ ur nehhṛeɣ ara tasnasɣalt-inu.
Qqleɣ-d bac ad heḍṛeɣ daɣen yid-wen.
Qrib ad d-yeɣli ubra n ukerbas-nnek.
Qrib ad d-yeɣli ubra n ukerbas-nnem.
Qrib ad d-yeqqel s axxam? Ur cikkeɣ.
Qrib ad sṛuḥen yisekla afriwen-nsen.
Qrib ula d yiwen ur d-irezzu fell-i.
Qrib ulac akk win ara d-iwten deg-s.
Qrib ur d-nnint ula d yiwen n wawal.
Qrib ur d-tenni ula d yiwen n wawal.
Qrib ur d-yenni ula d yiwen n wawal.
Ran ad walin isafagen mi ara qelɛen.
Rḍel-iyi-d astilu-nni deg leɛnaya-k.
Rebbḥeɣ tawinest n wuṛuten deg wass.
Refden irazalen-nsen s tin n leqder.
Ṛeggmen-d ad ilin da ɣef tis sḍiset.
Rɣiɣ akken ad tt-ẓreɣ tikkelt niḍen.
Riɣ ad waliɣ isafagen mi ara qelɛen.
Riɣ nik ad irireɣ aked trabbut nnek.
Riɣ-k seg wasmi ay nella d inubiyen.
Ṛju ad ak-d-fkeɣ uḍḍun-inu n usawal.
Ṛju ad am-d-fkeɣ uḍḍun-inu n usawal.
Ṛjumt ad awent-d-awiɣ isgaten-nwent.
Rniɣ s snat n lkilwat deg unebdu-ya.
Rnu kan cwiṭ, ad tawḍeḍ ɣer tqacuct.
Rnu-yi-d azuḥ n latay deg leɛna-yak.
Rran ikerbasen-nni acku ḥeṛsen aṭas.
Rremt-asent-d ayla-nsent ttxil-kent.
Rriɣ deg umuɣ ayen i ilaq ad xedmeɣ.
Ṛṛuz imeɣɣi-d deg tmura yemmuẓeɣlen.
Ruḥ ad rewleɣ yeṭṭef-iyi-d deg ufus.
Ruḥ tura yakan, ma ulac ad tɛeṭṭleḍ.
Ruḥeɣ ɣer Bgayet ass-nni n letnayen.
Ṛuḥet tura, neɣ ad ken-teǧǧ tmacint.
Ṛum ur tettwabna ara deg yiwen wass.
Ruma mačči deg yiwen wass i d-tella.
Rẓaget tudert ma ulac wid i nḥemmel.
Rzan ar tferkiwin-nsen ad ten-neqcen
Rẓem bessi taqqet, lḥal yexjen dani.
S Internet ay ssenzeɣ iceḍḍiḍen-nni.
S kra ay yesɛa d idrimen, ur yefṛiḥ.
S kra n wayen ay yetteg Bush iṣeḥḥa.
S kra n win ay yeẓra Bob, iwehha-as.
S lferḥ ara d-rreɣ ɣef usteqsi-inek.
S taduṭ n yizamaren i yezḍa ubernus.
S tewzel, kullec iɛedda akken iwata.
S tidet bɣiɣ ad ṭṭseɣ alamma d azal.
S tidett yessefk ad nuɣal ar deffir?
S tkeṛṛust ay d-tusamt neɣ s usakal?
S tmeɛmada ay tgamt tuccḍa-nni, naɣ?
S tmussni i ttaẓen yegduden ar zdat.
S umata, igerdan ḥemmlen tiḥelwatin.
S umata, irgazen jehden ɣef tsednan.
S umata, irgazen meqqrit ɣef lxalat.
S umata, irgazen meqqrit ɣef tlawin.
S umata, ntteddu s aɣerbaz ɣef uḍar.
S umata, nttett iselman d izegzawen.
S umata, ttawḍeɣ s axxam ɣef ssetta.
S usakal ay d-tettasemt ɣer uɣerbaz?
S ustehzi i ihedder dima ɣef unabaḍ.
S uxeddim, kullec nezmer ad t-naweḍ.
S wacu ara tqablemt aseggas amaynut?
S waman d ssabun i yessared udem-is.
S yidrimen nezmer ad naɣ kra yellan.
S yiqbayliyen ar ad tejbu teqbaylit!
Sameḥ-iyi i mi ur ak-d-rriɣ ara zik.
Sameḥ-iyi kan, aql-i ttwaṭṭfeɣ tura.
Sameḥ-iyi kan, tzemreḍ ad d-tɛawdeḍ?
Sami ad kem-yalel ma tesrid tallalt.
Sami ad ken-yalel ma tesrim tallalt.
Sami ad k-yalel ma teḥwajed tallalt.
Sami ad yeg amzun leɛmeṛ yeḍri waya.
Sami d Layla llan kan la ttqeṣṣiren.
Sami d Layla llan kan qqimen kifkif.
Sami ha-t-an la yessawal i temsulta.
Sami iban-d amzun yenqes deg lmizan.
Sami iǧǧa dinna amrig d aḥuddu-ines.
Sami ila ɣer-s tasarut-nnes n uxxam.
Sami ireffu s tidet mi ara iẓer aya.
Sami leɛmeṛ id yemugger ugur am-agi.
Sami llant zzint-d fell-as teqcicin.
Sami ur iwala ara yark Layla tettru.
Sami ur yelli ara yettban d imseḍru.
Sami ur yezmir ara ad ixelleṣ lekra.
Sami ur yeẓri ara anta-tt teqjunt-a.
Sami ur-d iru y-ara yark di lǧanaza.
Sami werǧin yeddi ɣer kra n tekrict.
Sami yebda iɣelli deg tayri n Layla.
Sami yebda yettmecčiw d umsaltu-nni.
Sami yebɣa ad iẓer d acu ara yeḍrun.
Sami yebɣa ad iẓer Layla tettbeccic.
Sami yebɣa ad yexdem yiwet n tɣawsa.
Sami yeffer lehyuf ddaw w wusu-ines.
Sami yefka tameẓyant-nni i temsulta.
Sami yeɣs ad k-iẓer uqbel ad teddud.
Sami yeɣtes ad yeffeɣ seg uxxam-nni.
Sami yeɣtes ad yexdem ayenni swaswa.
Sami yeḥwaj s tidet ad iṛuḥ s abduz.
Sami yella d aselmad-inu n tserɣint.
Sami yella ilaq ad iṛuḥ ɣer uɣerbaz.
Sami yella la itteddu ad iẓer Layla.
Sami yella la yettnadi amahil niḍen.
Sami yella la yettnadi ɣef tseksilt.
Sami yella la yettqellib ɣef umahil.
Sami yella yebɣa ad yeccečč anezraf.
Sami yella yesɛa axxam d axlaf mliḥ.
Sami yella yesseqdac aselkim usawen.
Sami yella yesseqdac awal n unigrut.
Sami yella yettban-d d amdan yelhan.
Sami yella yezdeɣ deg uxxam n Layla.
Sami yella yezdeɣ deg yiwen n uxxam.
Sami yella yezdeɣ gar Maṣer d Surya.
Sami yella yezmer ad yili d ameckuk.
Sami yemqabal d Layla ɣef temsalt-a.
Sami yenna-d lumuṛ n diri ɣef Layla.
Sami yerfed taduli-nni ɣef yiman-is.
Sami yerza ɣef wacḥal n tmesgidiwin.
Sami yesmeɛreq amzun ulac akk Layla.
Sami yessaweḍ Layla ɣer tkeṛṛust-is.
Sami yessawel-as a tazurant i Layla.
Sami yessers taculliḍt ɣef ukuntwaṛ.
Sami yessuter ad yawi axxam n Layla.
Sami yettṛuḥu ɣer tbanka yal imalas.
Sami yewhem s wayen yufa deg Leqran.
Sami yexdem d aqeddac deg tneččiyin.
Sami yexdem-d imdukal deg uɣerbaz-a.
Sami yezdeɣ deg temdint d tameqrant.
Sami yeẓra kullec ɣef uxḍaf n Layla.
Sami yudef ɣer uqusis n tsenselkimt.
Sami yufa targa-s n Layla n YouTube.
Sanda ay ddant ass n usimwas yezrin?
Sanda ay la tteddun yimeddukal-nnek?
Sanda ay la tteddun yimeddukal-nnem?
Sanda ay la tteddun yimeddukal-nwen?
Sanda ay la tteddunt tmeddukal-nnem?
Sanda ay la tteddunt tmidiwin-nwent?
Sanda ay tedda ass n usimwas yezrin?
Sanda ay teddam ass n ljemɛa yezrin?
Sanda ay teddukkel Taninna ed Yidir?
Sanda ay terra Taninna tabalizt-inu?
Sanda ay terra Taninna tammumun-nni?
Sanda ay terra Taninna tasarut-nnes?
Sanda ay terra Taninna tasiwant-inu?
Sanda ay yedda ass n usimwas yezrin?
Sarameɣ ad kem-waliɣ tikkelt-nniḍen.
Sarameɣ ad ken-waliɣ tikkelt-nniḍen.
Sarameɣ ad sɛuɣ tiqcicin timelḥanin.
Sarameɣ ulac tin i yi-d-iẓaṛen akka.
Sarameɣ ulac win i yi-d-iẓaṛen akka.
Sbeddent iqiḍunen-nsent deg teftist.
Sɛan aṭas n termit akked yiselkimen.
Sɛan ayen i ttnadin deg txemmamt-nni
Sɛan sin n yimeddukal d ibeṛṛaniyen.
Sɛeddi-iyi-d tisent, ma ulac aɣilif.
Seg ansi i ak-d-kkant akk tsura-nni?
Seg ansi i am-d-kkant akk tsura-nni?
Seg idelli uḍneɣ iqreh iyi uqerru-iw
Seg melmi ay la teqqared tafṛensist?
Seg melmi ay la teqqareḍ tafṛensist?
Seg melmi ay la teqqarem tafṛensist?
Seg melmi ay la tlemmdemt talatinit?
Seg melmi ay la tzerrwed tafṛensist?
Seg melmi ay la tzerrweḍ tafṛensist?
Seg melmi ay la tzerrwem tafṛensist?
Seg melmi kan ay d-nusa ɣer temdint.
Seg tama taṛktit ay ttafgen s anẓul.
Seg wakken d asemmiḍ, ur ḍḍiseɣ ara.
Seg wanseg ay d-tulyeḍ ɣer usakac-a?
Seg wansi akka ay k-id-tusa takti-a?
Seg wansi ay as-d-tekka teftart-nni?
Seg wansi ay asen-d-kkan yidrimen-a?
Seg wansi ay asent-d-kkan waman-nni?
Seg wansi ay awen-d-kkan yidrimen-a?
Seg wansi ay awent-d-kkan waman-nni?
Seg wansi ay awent-d-yekka usawal-a?
Seg wansi ay d-sɣan tiqremsiyin-nni?
Seg wansi ay d-sɣant tijeǧǧigin-nni?
Seg wansi ay d-tesɣa Taninna ti akk?
Seg wansi ay d-tesɣa Taninna wi akk?
Seg wansi ay d-tesɣa tijeǧǧigin-nni?
Seg wansi ay d-tesɣam ikebbuḍen-nni?
Seg wansi ay d-tesɣam ikerbasen-nni?
Seg wansi ay d-tesɣam ikerziyen-nni?
Seg wansi ay d-tesɣam ilemḍaden-nni?
Seg wansi ay d-tesɣam iserwalen-nni?
Seg wansi ay d-tesɣam itrikuten-nni?
Seg wansi ay d-tesɣam taqendurt-nni?
Seg wansi ay d-tesɣamt irazalen-nni?
Seg wansi ay d-tesɣamt irkaseni-nni?
Seg wansi ay d-tesɣamt tasiwant-nni?
Seg wansi ay d-tewwi Taninna umuɣ-a?
Seg wansi ay d-tmecḍed acebbub-nnem?
Seg wansi ay d-yesɣa tijeǧǧigin-nni?
Seg wansi ay zemreɣ ad ḍḍfeɣ amiṭru?
Seg wasmi i myussanent ur mfaraqent.
Seg wasmi i truḥemt ur d-testeqsamt.
Seg wasmi i t-teǧǧa ur yufi iman-is.
Seg wasmi i yuḍen ur iḍal ɣef lehna.
Seg wass n lḥedd ay tuḍen Alice aḍu.
Seg yimir-nni ay neqqel d imeddukal.
Seg yimir-nni ay neqqel ur t-neẓẓar.
Seg yimir-nni ur tulis ad iyi-tlaɛi.
Seg yimir-nni ur yulis ad iyi-ilaɛi.
Seg-a ɣer London llan tam n yimilen.
Seg-a ɣer sdat, ad nkemmel ɣef uḍar.
Sɛiɣ asihaṛ d yimsujji ɣef tis mraw.
Sɛiɣ asihaṛ ed temsujjit tameddit-a.
Sɛiɣ asihaṛ ed yimsujji tanezzayt-a.
Sɛiɣ asihaṛ ɣer yimsujji n tiṭṭawin.
Sɛiɣ aṭas n termit akked yiselkimen.
Sɛiɣ aṭas n tɣawsiwin ara ak-d-mleɣ.
Sɛiɣ axeddim asmi lliɣ leɛmeṛ-nkent.
Sɛiɣ azref ad as-ɣreɣ i ubugaṭu-inu.
Sɛiɣ da akaraf i as-d-yettwaceyyɛen.
Sɛiɣ gma sennig-i d uletma seddaw-i.
Sɛiɣ sin n yimeddukal d ibeṛṛaniyen.
Sɛiɣ snat n tenfulin i temlilit-nni.
Sɛiɣ snat n yessetma ed yiwen n gma.
Sɛiɣ tabagust taberkant deg ukarate.
Sɛiɣ tam n waytmaten ed teysetmatin.
Sɛiɣ tamcict tamecṭuḥt isem-is Nina.
Sɛiɣ tasnasɣalt swaswa am tin-nwent.
Sɛiɣ tuttra i kenwi akken ma tellam.
Sɛiɣ yiwen n gma ed snat n yessetma.
Sɛiɣ yiwen n umidi, baba-s d abiḍar.
Sɛiɣ yiwet n tɣawsa ad awen-tt-fkeɣ.
Sɛiɣ yiwet n tɣawsa ad m-tt-id-fkeɣ.
Sɛiɣ yiwet n tmeddakelt d timsujjit.
Sɛiɣ zzheṛ imi ay d-ufiɣ tisura-inu.
Sekṛeɣ ama d tiwwura, ama d tizewwa.
Sekṛen ama d tiwwura, ama d tizewwa.
Sekṛent yernu bdant ssuggutent awal.
Sel, ur yeẓri d acu ay la d-yettini.
Sel-as i Lani Rabeḥ ad k-ikkes lxiq.
Selleɣ i kra n yiwen i yettmeslayen.
Selleɣ i yiwerjejjiḍen qrib yal ass.
Selmed-as ad yesmeḥsis akk i medden.
Semman yimawla-nni i mmi-tsen Akira.
Semman-as i uɣerrabu-nni Mayflower .
Senndeɣ ɣer liḥiḍ, rjiɣ ad d-truḥeḍ.
Seqqi-d, ternuḍ-iyi-d aksum ttxilem!
Serkem aman-nni send ad ten-tessewḍ.
Serreḥ i tfekka-nnek akken ma tella.
Serreḥ i tfekka-nnem akken ma tella.
Serreḥ i yiman-nnek, ma ulac aɣilif.
Sers iqecran-nni deg ubidun-iḥuccan.
Setḥaɣ ad as-sutreɣ ugar n yidrimen.
Sɣemt-d tinfulin ɣef zik lḥal seg-a.
Sɣemt-d tinfulin-nwent ɣef zik lḥal.
Sɣemt-iyi-d tanfult, ma ulac aɣilif.
Sɣiɣ-d adlis-nni s mraw n yidulaṛen.
Sgumiɣ ad amneɣ belli yessuden-ikem.
Sgumiɣ ad ẓreɣ ayen i yi-d-teqqareḍ.
Sḥassfeɣ i k-imeḥḥnen akk annect-en.
Sḥassfeɣ imi ur teḥḍir ara i usarag.
Si dqiqa ɣer tayeḍ ad d-yili da Tom.
Si zik ttarguɣ ad sɛuɣ aṭas igerdan.
Simal yettett, simal irennu yettlaẓ.
Simmal a tḥerreṣ gar Marikan d Rrus.
Simmal ttiɣzifen wussan rennun ugar.
Simraw n yiseggasen d akud ɣezzifen.
Sin iseggasen aya seg mi immut baba.
Sin iseggasen aya seg mi immut Ṭaṛu.
Sin-nni n yebriden ttemyegzamen din.
Sin-nni n yebriden ttemyezgaren din.
Sired tatteffaḥt uqbel ad tt-teččeḍ.
Sit da akken ad trewled i tselɣut-a.
Sit ɣef tqeffalt n ENTER, dɣa dayen!
Siwel-iyi-d ma yella kra i ibeddlen.
Slemt mliḥ i wayen ara awent-d-iniɣ.
Slet-as i Uleḥlu ad awen-ikkes lxiq.
Sliɣ dakken ad tgemt timlilit ass-a.
Sliɣ dakken ad tlemt timlilit ass-a.
Sliɣ dakken imir-a aql-ik d imsujji.
Sliɣ i medden ssawalen aṭas fell-ak.
Sliɣ i medden ssawalen aṭas fell-am.
Sliɣ-as acḥal d tikkelt yenna-d aya.
Sliɣ-as tessawal tanglizit am waman.
Smeɛrqent fehment asefru-nni n Mary.
Smenyafeɣ ad dduɣ ass-a wala azekka.
Smenyafeɣ ad iliɣ ɣer sdat n usakal.
Smenyafeɣ ad sweɣ akeffay wala iẓem.
Smenyafeɣ taɣlust wala atay aberkan.
Smenyifeɣ tiččintin ɣef tetteffaḥin.
Smineg agaraw, maca qqim deg tegnit.
Snat n tsaɛtin aya segmi ay lliɣ da.
Snat-a n teysetmatin-a d ticelhabin.
Snat-nni n teysetmatin cebḥent aṭas.
Sqerdcet imi tella tlelli n umeslay!
Sriɣ ad tged yiwet n teɣri s usawal.
Sriɣ ad tgem yiwet n teɣri s usawal.
Ssaɣayeɣ ticemmaɛin deg texxamt-inu.
Ssarameɣ ad neqqim dima d imeddukal.
Ssarameɣ ad teqqled d ameddakel-inu.
Ssarameɣ kullec ad ifak akken yelha.
Ssarameɣ ur tettɛeṭṭil ara ad telḥu.
Ssarameɣ-as ḥellu iɛejlen i yemma-k.
Ssarameɣ-as ḥellu iɛejlen i yemma-m.
Ssardeɣ ifassen-inu acku llan umsen.
Ssardeɣ ifassen-iw s waman d ṣṣabun.
Ssawaleɣ sin n yilsawen ibeṛṛaniyen.
Ssawalen sin n yilsawen ibeṛṛaniyen.
Ssebba n waṭṭanen-a d ayefki yumsen.
Ssedhayeɣ iman-iw s tɣuri aked tira.
Ssefhem-it-id tikkelt niḍen a Jerry.
Ssefran ad gen asarag-nni deg Tokyo.
Ssefsin anfed-nni, rran-t d agestur.
Sseɣliɣ s yiman-inu ɣer weswir-nnes.
Sseɣtaɣ tafyirt-nni war ma cawṛeɣ-t.
Sselfeɣ i yicenfiren-nnes ilewwaɣen.
Ssenɛet-iyi-d acu yellan di lǧib-ik.
Sseqdacen tixxamin-nsen akken iwuta.
Ssetḥaɣ aṭas mi tt-mmuqqleɣ s allen.
Ssetḥaɣ imi ay ak-ɣriɣ a ameddakel .
Ssew tijeǧǧigin-nni, ma ulac aɣilif.
Ssidef akerbas-nnek ɣer usewal-nnek.
Ssidef akerbas-nnem ɣer usewal-nnem.
Ssirid ifassen-nnek uqbel ma tecciḍ.
Ssirideɣ takeṛṛust-inu qrib yal ass.
Ssirreq irkasen-nni, ma ulac aɣilif.
Ssiwel-iyi-d cwiṭ ɣef ussikel-nwent.
Ssken-iyi-d acu yellan di temzit-ik.
Ssneɣ yiwet n teqcict d tamarikanit.
Ssneɣ-tt seg wasmi i tella meẓẓiyet.
Ssudneɣ-tt war ma nniɣ-d ula d awal.
Ssuffeɣ tadabut-nni, ma ulac aɣilif.
Ssufɣeɣ ay ulun at ɣerneɣ s teddart.
Ssuqqlemt-d tafyirt-a ɣer tanglizit.
Ssuref-aɣ imi ur nezmir ad k-nɛawen.
Ssuref-iyi imi ay ak-nniɣ a akeddab.
Ssuref-iyi imi ay k-cewwleɣ lawan-a.
Ssuref-iyi, maca ur sɛiɣ ara aqariḍ.
Ssuref-iyi, nekk ad jebdeɣ iman-inu.
Ssuref-iyi, ur zemmreɣ ara ad ṛuḥeɣ.
Ssurfemt-iyi ɣef wayen ay awent-giɣ.
Ssutreɣ asaruf seg wakk taɣlamt-nni.
Ssutreɣ aṭas n yedlisen seg Langliz.
Ssutreɣ ssmaḥ ɣef tuccḍa-nni ay giɣ.
Ssutreɣ-as ad iyi-d-yessawaḍ isalan.
Sswid tla tutlayt-nnes i yiman-nnes.
Sswis isem-nnes Suisse s tefṛensist.
Sswis ttinin-as Suisse s tefṛensist.
Ssya ɣer ssmana, ad iliɣ deg Legliz.
Ssya ɣer xemsa izergan i d axxam-iw.
Steɛṛfeɣ dakken tullemt-iyi s waṭas.
Suref-iyi kan, anda tella temkerḍit?
Suref-iyi kan, aql-i ttwaṭṭfeɣ tura.
Surfemt-iyi. Anda i llant tmellalin?
Susan ur tettsemmiḥ ara deg yemma-s.
Susem, ur ttmeslay ara mi tettetteḍ.
Susmemt deg leɛnaya-nkent la qqaṛen!
Susmemt deg leɛnaya-nkent la teqqaṛ!
Susmemt deg leɛnaya-nkent la yeqqaṛ!
Swiɣ afenjal n teɣlust deg tneɣlust.
Sya dasawen yal yiwen yawi abrid-is.
Ta d tasiwant-inu, maci d tin n Tom.
Ta ur nezmir ad as-nsemmi tameddurt.
Tabanka-nni tezga-d sdat tesreqqest.
Taceṛṛaft igget wel ttwixzir ajenna.
Tacifuft-nni tufeg, tedda deg uzniq.
Tacifuft-nni tuli s igenni s leɛqel.
Tadamsa tajapunit tennerna s tazzla.
Tafḍiḥt-a tessames-as tisellat-nnes.
Taftist-nni tella qrib d tilemt akk.
Tafyirt-a werɛad ur d-tettwassuqqel.
Taɣara n yiḍrisen-is tuweḍ s igenni.
Taɣlamt tettwali-t d aqebṭan yelhan.
Taɣlamt-nni teḥwaj ugar n yimariren.
Taglisya attan din kan deffir ubrid.
Tagnit-nnek ur telli ara d tamayust.
Tagnit-nnem ur telli ara d tamayust.
Tagnit-nwen ur telli ara d tamayust.
Tagrest d unebdu i yettaṭṭafen aṭas.
Taɣsert n tmacint teqreb ɣer usensu.
Taɣtest tegguma ad truḥ ad teccetki.
Taɣuri n wedlis d taɣawsa timseknut.
Taḥanut-nni teɣleq ɣef tis semmuset.
Tajeǧǧigt-nni tamecṭuḥt d tamellalt.
Takatalanit ssawalen-tt deg Andorra.
Takerrict-nni teḥṣel-as deg ugerjum.
Takeṛṛust tbeddel-aɣ tameddurt-nneɣ.
Takeṛṛust-a tettwakter-d seg Lalman.
Takeṛṛust-inu mecṭuḥet ɣef tin-nnek.
Takeṛṛust-inu tettett aṭas n tumast.
Takeṛṛust-nsent tɛedda ɣef tin-nneɣ.
Takeṛṛust-nsent tɛedda ɣef tin-nteɣ.
Taklizt attan deg tlemmast n yiɣrem.
Taklut d taɣawsa niḍen aydeg ẓewreɣ.
Takrabaḍt-a terna ɣef tkebbuḍt-inna.
Takravaḍt-a ur terni ɣef uselsu-inu.
Talemmiẓt-a ur telli trewla fell-as.
Talɣut-a tesɛa azal ameqran ɣer-neɣ.
Tallit-nni ttinin-as Tallit n Weẓru.
Tamacint ad tɛeḍḍel simraw n tmikin.
Tamacint n tarda d asnulfu igerrzen.
Tamacint-nni tella ɛlaḥal ad teqleɛ.
Tamaneɣt n Albanya isem-nnes Tirana.
Tamcict atta ɣef tgertilt n tẓallit.
Tamdint iɣer tettruḥuḍ, tebɛed aṭas.
Tamdint-nni jjan-tt yimezdaɣen-nnes.
Tameddakelt-nnes terfa mliḥ fell-as.
Tameddit ad neẓwa ad neskiya lɣabet.
Tameddit-a, ad ak-d-iceggeɛ tansa-s.
Tameddit-a, ad am-d-iceggeɛ tansa-s.
Tameddit-a, ad am-d-tceggeɛ tansa-s.
Tameddurt n Layla tella d taferkakt.
Tameddurt-nnek maci akk d tameddurt.
Tameddurt-nnem maci akk d tameddurt.
Tameddurt-nsen ur tt-ixuṣṣ wara akk.
Tameddurt-nwen maci akk d tameddurt.
Tameɣra-nni sfuglen-tt ɣef tis mraw.
Tameṭṭut tettkel ɣef tarwa n laḥlal.
Tameṭṭut-nnek tesɛa zzheṛ d ameqran.
Tameṭṭut-nnes tettmahal deg tɣiwant.
Tameṭṭut-nni tessakay-d taqcict-nni.
Tameṭṭut-nni ukud thedreḍ, d uletma.
Tamezgida tesɛa azal ɣer yinselmen .
Tamguri n tenfed d tamguri taxatart.
Tamḥaddit n teɣlamt-nneɣ turar mliḥ.
Tamkarḍit attan deg wannag amezwaru.
Tamkarḍit tusa-d deg wannag wis kuẓ.
Tamkarḍit-nni tesɛa aṭas n yidlisen.
Tamrint-inu tzad s ɛecṛa n tesdidin.
Tamsiwt Red tesselmed-iyi tajapunit.
Tamsiwt Thomas tesselmad-aɣ amezruy.
Tamsulta la tettnadi ɣef umakar-nni.
Tamurt taqbaylit tebɣa tilelli-ines.
Tamurt taqbaylit tesɛa takbabt-ines.
Tamurt-nneɣ d talwit kan i tettnadi.
Tamussni telha trennu azal i bab-is.
Tanarga merra tewhem deg isalli-nni.
Tanedlist-nni teḥbes assenzi n JUMP.
Taneffajt tmejreḍ s weḍran n unezwi.
Taneɣrit akk tella tettmuqqul-iyi-d.
Tanemmirt ɣef tjejjigin-nni icebḥen.
Tanemmirt ɣef wakk amahiɣ i txedmeḍ.
Tanemmirt i mi yi-tɛeṛḍem ar tmeɣṛa.
